{
  "artifact_groups": {
    "machine_assets": [
      "context_container",
      "validation_json",
      "release_attestation",
      "artifact_inventory",
      "release_spec_copy",
      "readme",
      "release_notes"
    ]
  },
  "artifacts": {
    "artifact_inventory": "codex_wire_audit_v19_artifact_inventory.json",
    "bundle": "codex_wire_audit_v19_config_surface_bundle.zip",
    "bundle_sidecar": "codex_wire_audit_v19_config_surface_bundle.zip.sha256",
    "checksums": "SHA256SUMS_codex_wire_audit_v19.txt",
    "context_container": "codex_wire_audit_v19_context_management_container.zip",
    "machine_assets": "codex_wire_audit_v19_machine_assets.zip",
    "readme": "README_CODEX_WIRE_AUDIT_V19.md",
    "release_attestation": "codex_wire_audit_v19_release_attestation.json",
    "release_notes": "CODEX_WIRE_AUDIT_V19_RELEASE_NOTES.md",
    "release_spec_copy": "codex_wire_audit_v19_release_spec.json",
    "sdist": "codex_wire_audit-12.0.0.tar.gz",
    "source_zip": "codex_wire_audit_v19_source.zip",
    "validation_json": "codex_wire_audit_v19_validation.json",
    "validation_log": "codex_wire_audit_v19_validation.txt",
    "wheel": "codex_wire_audit-12.0.0-py3-none-any.whl"
  },
  "capability_claims": [
    {
      "extractor_ids": [
        "extractor.turn_metadata"
      ],
      "id": "turn_metadata",
      "profile_assertions": {
        "hybrid_v19": {
          "required_extractors_contains": [
            "extractor.turn_metadata"
          ]
        }
      },
      "required_resources": [
        "extractors/turn_metadata.py",
        "schema_templates/turn-metadata-semantics.schema.json"
      ],
      "status": "active_package"
    },
    {
      "container_verifier": "codex_wire_audit.context_management_reference:verify_context_management_container",
      "extractor_ids": [
        "extractor.context_management"
      ],
      "id": "context_management",
      "profile_assertions": {
        "codex_wire_full": {
          "required_extractors_contains": [
            "extractor.context_management"
          ],
          "required_runtime_scenarios_contains": [
            "context_management_activation",
            "context_window_rollover",
            "history_notes_retrieval"
          ]
        },
        "hybrid_v19": {
          "required_extractors_contains": [
            "extractor.context_management"
          ]
        }
      },
      "required_resources": [
        "extractors/context_management.py",
        "extractors/context_management_support.py",
        "context_management_reference.py",
        "coverage_profiles.v3.json",
        "proof_schema_templates/context-management-semantics-v1.schema.json",
        "context_management_container_data/index.json",
        "context_management_container_data/current_main.json"
      ],
      "status": "active_package"
    },
    {
      "container_verifier": "codex_wire_audit.metadata_history_reference:verify_metadata_history_container",
      "extractor_ids": [],
      "id": "metadata_history",
      "profile_assertions": {
        "hybrid_v19": {
          "required_dimensions_contains": [
            "metadata_history"
          ]
        }
      },
      "required_resources": [
        "metadata_history.py",
        "metadata_history_container.py",
        "metadata_history_reference.py",
        "metadata_history_data/metadata-key-history.v1.json",
        "metadata_history_container_data/index.json"
      ],
      "status": "active_package"
    },
    {
      "extractor_ids": [
        "extractor.config_effects"
      ],
      "id": "config_surface",
      "profile_assertions": {
        "codex_wire_full": {
          "required_extractors_contains": [
            "extractor.config_effects"
          ],
          "required_runtime_scenarios_contains": [
            "config_schema_surface_graph"
          ]
        },
        "config_surface_only": {
          "required_extractors_contains": [
            "extractor.config_effects"
          ],
          "required_runtime_scenarios_contains": [
            "config_schema_surface_graph"
          ]
        },
        "hybrid_v19": {
          "required_extractors_contains": [
            "extractor.config_effects"
          ]
        }
      },
      "required_resources": [
        "config_schema_catalog.py",
        "config_feature_registry.py",
        "config_effect_specs.py",
        "surface_graph.py",
        "extractors/config_effects.py",
        "proof_schema_templates/config-surface-semantics-v1.schema.json",
        "coverage_profiles.v3.json"
      ],
      "status": "active_package"
    },
    {
      "extractor_ids": [
        "extractor.local_storage"
      ],
      "id": "local_storage",
      "profile_assertions": {
        "codex_wire_full": {
          "required_extractors_contains": [
            "extractor.local_storage"
          ]
        },
        "local_storage_only": {
          "required_extractors_contains": [
            "extractor.local_storage"
          ]
        }
      },
      "required_resources": [
        "extractors/local_storage.py",
        "proof_schema_templates/local-storage-semantics-v2.schema.json",
        "coverage_profiles.v3.json",
        "extractors/local_storage_specs.py",
        "extractors/local_storage_sources.py",
        "extractors/local_storage_layout.py",
        "extractors/local_storage_lifecycle.py"
      ],
      "status": "active_package"
    },
    {
      "extractor_ids": [
        "extractor.prompt_context"
      ],
      "id": "prompt_context",
      "profile_assertions": {
        "codex_wire_full": {
          "required_extractors_contains": [
            "extractor.prompt_context"
          ]
        },
        "hybrid_v19": {
          "required_extractors_contains": [
            "extractor.prompt_context"
          ]
        },
        "prompt_context_only": {
          "required_extractors_contains": [
            "extractor.prompt_context"
          ]
        }
      },
      "required_resources": [
        "extractors/prompt_context.py",
        "proof_schema_templates/prompt-context-semantics-v1.schema.json",
        "coverage_profiles.v3.json"
      ],
      "status": "active_package"
    },
    {
      "extractor_ids": [
        "extractor.execution_policy"
      ],
      "id": "execution_policy",
      "profile_assertions": {
        "codex_wire_full": {
          "required_extractors_contains": [
            "extractor.execution_policy"
          ]
        },
        "execution_policy_only": {
          "required_extractors_contains": [
            "extractor.execution_policy"
          ]
        },
        "hybrid_v19": {
          "required_extractors_contains": [
            "extractor.execution_policy"
          ]
        }
      },
      "required_resources": [
        "extractors/execution_policy.py",
        "proof_schema_templates/execution-policy-semantics-v1.schema.json",
        "coverage_profiles.v3.json"
      ],
      "status": "active_package"
    },
    {
      "extractor_ids": [
        "extractor.plugin_runtime"
      ],
      "id": "plugin_runtime",
      "profile_assertions": {
        "codex_wire_full": {
          "required_extractors_contains": [
            "extractor.plugin_runtime"
          ]
        },
        "hybrid_v19": {
          "required_extractors_contains": [
            "extractor.plugin_runtime"
          ]
        },
        "plugin_runtime_only": {
          "required_extractors_contains": [
            "extractor.plugin_runtime"
          ]
        }
      },
      "required_resources": [
        "extractors/plugin_runtime.py",
        "proof_schema_templates/plugin-runtime-semantics-v1.schema.json",
        "coverage_profiles.v3.json"
      ],
      "status": "active_package"
    },
    {
      "extractor_ids": [
        "extractor.execution_environment"
      ],
      "id": "execution_environment",
      "profile_assertions": {
        "codex_wire_full": {
          "required_extractors_contains": [
            "extractor.execution_environment"
          ]
        },
        "execution_environment_only": {
          "required_extractors_contains": [
            "extractor.execution_environment"
          ]
        },
        "hybrid_v19": {
          "required_extractors_contains": [
            "extractor.execution_environment"
          ]
        }
      },
      "required_resources": [
        "extractors/execution_environment.py",
        "proof_schema_templates/execution-environment-semantics-v1.schema.json",
        "coverage_profiles.v3.json"
      ],
      "status": "active_package"
    },
    {
      "extractor_ids": [
        "extractor.routing_transport",
        "extractor.redirect_headers"
      ],
      "id": "routing_transport",
      "profile_assertions": {
        "codex_wire_full": {
          "required_extractors_contains": [
            "extractor.routing_transport",
            "extractor.redirect_headers"
          ]
        },
        "hybrid_v19": {
          "required_extractors_contains": [
            "extractor.routing_transport",
            "extractor.redirect_headers"
          ]
        },
        "routing_transport_only": {
          "required_extractors_contains": [
            "extractor.routing_transport",
            "extractor.redirect_headers"
          ]
        }
      },
      "required_resources": [
        "extractors/routing_transport.py",
        "proof_schema_templates/routing-transport-semantics-v1.schema.json",
        "coverage_profiles.v3.json",
        "extractors/redirect_headers.py",
        "proof_schema_templates/redirect-header-semantics-v1.schema.json"
      ],
      "status": "active_package"
    },
    {
      "extractor_ids": [
        "extractor.mcp_projection"
      ],
      "id": "mcp_projection",
      "profile_assertions": {
        "codex_wire_full": {
          "required_extractors_contains": [
            "extractor.mcp_projection"
          ]
        },